{"contract_version":"full-delivery-v1","revision":1,"mode":"UNAVAILABLE","capability_id":"learning-v1","document":{"provider_id":"document","implemented":false,"available":false,"mode":"UNAVAILABLE","features":[],"status":"UNAVAILABLE","reason_code":"MODULE_NOT_DELIVERED","needed_action":"接入该角色的完整模块并完成配置与实测。","data_flow":[]},"sources":{"provider_id":"sources","implemented":false,"available":false,"mode":"UNAVAILABLE","features":[],"status":"UNAVAILABLE","reason_code":"MODULE_NOT_DELIVERED","needed_action":"接入该角色的完整模块并完成配置与实测。","data_flow":[]},"tutor":{"provider_id":"tutor","implemented":false,"available":false,"mode":"UNAVAILABLE","features":[],"status":"UNAVAILABLE","reason_code":"MODULE_NOT_DELIVERED","needed_action":"接入该角色的完整模块并完成配置与实测。","data_flow":[]},"persistent_notes":true,"legacy_readable":true,"integrated_product":"UNAVAILABLE","target_hardware":"NOT_TESTED","lead_review":"PENDING","status":"PARTIAL"}
